uuid,global_rating,number_of_ratings,name,steps,meal_type,origin,prep_time,servings,description,difficulty,photo_url
02f1939873c5ed70986c,5,544,Veggie shepherd's pie with sweet potato mash,"Heat 1 tbsp olive oil in a frying pan, then fry 1 halved and sliced large onion until golden.Add 2 large carrots, cut into sugar-cube size pieces and most of the 2 tbsp chopped thyme, reserving a sprinkling for later.Pour in 200ml red wine, 150ml water and a 400g chopped tomatoes, then crumble in 2 vegetable stock cubes and simmer for 10 mins.Tip in a 410g can green lentils, including the juice, then cover and simmer for another 10 mins until the carrots still have a bit of bite and the lentils are pulpy.Meanwhile, boil 950g sweet potatoes, cut into chunks, for 15 mins until tender, drain well, then mash with 25g butter and season to taste.Pile the lentil mixture into a pie dish, spoon the mash on top, then sprinkle over 85g grated vegetarian mature cheddar and the remaining thyme. The pie can now be covered and chilled for 2 days, or frozen for up to a month.Heat oven to 190C/170C fan/gas 5. Cook for 20 mins if cooking straightaway, or for 40 mins from chilled, until golden and hot all the way through. Serve with broccoli.",main,English,70,4,The secret to this shepherd's pie’s filling is to choose big carrots so they don’t lose their texture when cooked...,Easy,www.bbcgoodfood.com/sites/default/files/styles/recipe/public/user-collections/my-colelction-image/2015/12/recipe-image-legacy-id--560451_11.jpg?itok=ma2pok11
0528174c0168ac50d4d4,5,574,Cottage pie,"Heat 1 tbsp olive oil in a large saucepan and fry 1¼ kg beef mince until browned – you may need to do this in batches. Set aside as it browns.Put the other 2 tbsp olive oil into the pan, add 2 finely chopped onions, 3 chopped carrots and 3 chopped celery sticks and cook on a gentle heat until soft, about 20 mins.Add 2 finely chopped garlic cloves, 3 tbsp plain flour and 1 tbsp tomato purée, increase the heat and cook for a few mins, then return the beef to the pan.Pour over a large glass of red wine, if using, and boil to reduce it slightly before adding the 850ml beef stock, 4 tbsp Worcestershire sauce, a few thyme sprigs and 2 bay leaves.Bring to a simmer and cook, uncovered, for 45 mins. By this time the gravy should be thick and coating the meat. Check after about 30 mins – if a lot of liquid remains, increase the heat slightly to reduce the gravy a little. Season well, then discard the bay leaves and thyme stalks.Meanwhile, make the mash. In a large saucepan, cover the 1.8kg potatoes which you've peeled and chopped, in salted cold water, bring to the boil and simmer until tender.Drain well, then allow to steam-dry for a few mins. Mash well with the 225ml milk, 25g butter, and three-quarters of the 200g strong cheddar cheese, then season with freshly grated nutmeg and some salt and pepper.Spoon the meat into 2 ovenproof dishes. Pipe or spoon on the mash to cover. Sprinkle on the remaining cheese.If eating straight away, heat oven to 220C/200C fan/gas 7 and cook for 25-30 mins, or until the topping is golden.If you want to use a slow cooker, brown your mince in batches then tip into your slow cooker and stir in the vegetables, flour, purée, wine, stock, Worcestershire sauce and herbs with some seasoning. Cover and cook on High for 4-5 hours. Make the mash following the previous steps, and then oven cook in the same way to finish.",main,English,145,1,This great-value family favourite freezes beautifully and is a guaranteed crowd-pleaser,Easy,www.bbcgoodfood.com/sites/default/files/styles/recipe/public/recipe_images/recipe-image-legacy-id--1074465_10.jpg?itok=Zwn8Cd-1
92699b7582199135ad27,5,517,Home-style chicken curry,"Roughly chop 1 large onion, transfer to a small food processor, and add 3 tbsp of water - process to a slack paste. You could use a stick blender for this or coarsely grate the onion into a bowl – there’s no need to add any water if you are grating the onion. Tip into a small bowl and leave on one side.Put 6 roughly chopped garlic cloves and 50g roughly chopped ginger into the same food processor and add 4 tbsp water – process until smooth and spoon into another small bowl. Alternatively, crush the garlic to a paste with a knife or garlic press and finely grate the ginger.Heat 4 tbsp vegetable oil in a wok or sturdy pan set over a medium heat.Combine 2 tsp cumin seeds and 1 tsp fennel seeds with a 5cm cinnamon stick and 1 tsp chilli flakes and add to the pan in one go. Swirl everything around for about 30 secs until the spices release a fragrant aroma.Add the onion paste – it will splutter in the beginning. Fry until the water evaporates and the onions turn a lovely dark golden - this should take about 7-8 mins.Add the garlic and ginger paste and cook for another 2 mins – stirring all the time.Stir in 1 tsp garam masala, 1 tsp turmeric, and 1 tsp caster sugar and continue cooking for 20 secs before tipping in a 400g can chopped tomatoes.Continue cooking on a medium heat for about 10 mins without a lid until the tomatoes reduce and darken.Cut 8 skinless, boneless chicken thighs into 3cm chunks and add to the pan once the tomatoes have thickened to a paste.Cook for 5 mins to coat the chicken in the masala and seal in the juices, and then pour over 250ml hot chicken stock.Simmer for 8-10 mins without a lid until the chicken is tender and the masala lightly thickened – you might need to add an extra ladleful of stock or water if the curry needs it.Sprinkle with 2 tbsp chopped coriander and serve with Indian flatbreads or fluffy basmati rice and a pot of yogurt on the side.",main,Indian,45,4,A rustic and authentic quick Indian one-pot packed with tonnes of hot Asian spices and fragrant coriander,Easy,www.bbcgoodfood.com/sites/default/files/styles/recipe/public/user-collections/my-colelction-image/2015/12/recipe-image-legacy-id--908515_10.jpg?itok=rhm4Vwap
19d959d6874b812a9094,5,494,The best spaghetti bolognese recipe,"Put a large saucepan on a medium heat and add 1 tbsp olive oil.Add 4 finely chopped bacon rashers and fry for 10 mins until golden and crisp.Reduce the heat and add the 2 onions, 2 carrots, 2 celery sticks, 2 garlic cloves and the leaves from 2-3 sprigs rosemary, all finely chopped, then fry for 10 mins. Stir the veg often until it softens.Increase the heat to medium-high, add 500g beef mince and cook stirring for 3-4 mins until the meat is browned all over.Add 2 tins plum tomatoes, the finely chopped leaves from ¾ small pack basil, 1 tsp dried oregano, 2 bay leaves, 2 tbsp tomato purée, 1 beef stock cube, 1 deseeded and finely chopped red chilli (if using), 125ml red wine and 6 halved cherry tomatoes. Stir with a wooden spoon, breaking up the plum tomatoes.Bring to the boil, reduce to a gentle simmer and cover with a lid. Cook for 1 hr 15 mins stirring occasionally, until you have a rich, thick sauce.Add the 75g grated parmesan, check the seasoning and stir.When the bolognese is nearly finished, cook 400g spaghetti following the pack instructions.Drain the spaghetti and stir into the bolognese sauce. Serve with more grated parmesan, the remaining basil leaves and crusty bread, if you like.",main,Italian,135,6,"Our best ever spaghetti bolognese is super easy and a true Italian classic with a meaty, chilli sauce. This recipe comes courtesy of BBC Good Food user Andrew Balmer",Easy,www.bbcgoodfood.com/sites/default/files/styles/recipe/public/recipe_images/the-best-spaghetti-bolognese.jpg?itok=PH6AqY-g
194dd9e1bf7694493015,5,429,One-pot chicken chasseur,"Heat 1 tsp olive oil and half of the 25g butter in a large lidded casserole.Season 4 chicken legs, then fry for about 5 mins on each side until golden brown. Remove and set aside.Melt the remaining butter in the pan. Add 1 chopped onion, then fry for about 5 mins until soft.Add 2 crushed garlic cloves, cook for about 1 min, add 200g small button or chestnut mushrooms, cook for 2 mins, then add 225ml red wine.Stir in 2 tbsp tomato purée, let the liquid bubble and reduce for about 5 mins, then stir in 2 thyme sprigs and pour over 500ml chicken stock.Slip the chicken legs back into the pan, then cover and simmer on a low heat for about 1 hr until the chicken is very tender.Remove the chicken legs from the pan and keep warm. Rapidly boil down the sauce for 10 mins or so until it is syrupy and the flavour has concentrated.Put the chicken legs back into the sauce and serve.",main,French,110,4,This French bistro classic is easy to make at home and fabulous with creamy mash or crusty bread,Easy,www.bbcgoodfood.com/sites/default/files/styles/recipe/public/recipe_images/recipe-image-legacy-id--337457_12.jpg?itok=BkhdNf4R
18c4a29debd67599b36a,3,463,"Chicken, sweet potato & coconut curry","Heat the oil in a deep frying pan or wok, stir in the curry paste and fry for 1 minute. Add the chicken, sweet potatoes and lentils and stir to coat in the paste, then pour in the stock and coconut milk. Bring to the boil, then simmer for 15 minutes.Tip in the peas, bring back to the boil and simmer for a further 4-5 minutes. Season to taste before serving.",main,Indian,35,2,"Serve this mildly spiced curry with rice noodles, basmati rice or chappati breads and introduce your kids to curry",Easy,www.bbcgoodfood.com/sites/default/files/styles/recipe/public/recipe_images/recipe-image-legacy-id--1035630_11.jpg?itok=VHXc71xK
359dd9119bc954ae526d,5,1496,Best ever chocolate brownies recipe,"Cut 185g unsalted butter into small cubes and tip into a medium bowl. Break 185g dark chocolate into small pieces and drop into the bowl.Fill a small saucepan about a quarter full with hot water, then sit the bowl on top so it rests on the rim of the pan, not touching the water. Put over a low heat until the butter and chocolate have melted, stirring occasionally to mix them.Remove the bowl from the pan. Alternatively, cover the bowl loosely with cling film and put in the microwave for 2 minutes on High. Leave the melted mixture to cool to room temperature.While you wait for the chocolate to cool, position a shelf in the middle of your oven and turn the oven on to 180C/ 160C fan/ gas 4.Using a shallow 20cm square tin, cut out a square of non-stick baking parchment to line the base. Tip 85g plain flour and 40g cocoa powder into a sieve held over a medium bowl. Tap and shake the sieve so they run through together and you get rid of any lumps.Chop 50g white chocolate and 50g milk chocolate into chunks on a board.Break 3 large eggs into a large bowl and tip in 275g golden caster sugar. With an electric mixer on maximum speed, whisk the eggs and sugar. They will look thick and creamy, like a milk shake. This can take 3-8 minutes, depending on how powerful your mixer is. You’ll know it’s ready when the mixture becomes really pale and about double its original volume. Another check is to turn off the mixer, lift out the beaters and wiggle them from side to side. If the mixture that runs off the beaters leaves a trail on the surface of the mixture in the bowl for a second or two, you’re there.Pour the cooled chocolate mixture over the eggy mousse, then gently fold together with a rubber spatula. Plunge the spatula in at one side, take it underneath and bring it up the opposite side and in again at the middle. Continue going under and over in a figure of eight, moving the bowl round after each folding so you can get at it from all sides, until the two mixtures are one and the colour is a mottled dark brown. The idea is to marry them without knocking out the air, so be as gentle and slow as you like.Hold the sieve over the bowl of eggy chocolate mixture and resift the cocoa and flour mixture, shaking the sieve from side to side, to cover the top evenly.Gently fold in this powder using the same figure of eight action as before. The mixture will look dry and dusty at first, and a bit unpromising, but if you keep going very gently and patiently, it will end up looking gungy and fudgy. Stop just before you feel you should, as you don’t want to overdo this mixing.Finally, stir in the white and milk chocolate chunks until they’re dotted throughout.Pour the mixture into the prepared tin, scraping every bit out of the bowl with the spatula. Gently ease the mixture into the corners of the tin and paddle the spatula from side to side across the top to level it.Put in the oven and set your timer for 25 mins. When the buzzer goes, open the oven, pull the shelf out a bit and gently shake the tin. If the brownie wobbles in the middle, it’s not quite done, so slide it back in and bake for another 5 minutes until the top has a shiny, papery crust and the sides are just beginning to come away from the tin. Take out of the oven.Leave the whole thing in the tin until completely cold, then, if you’re using the brownie tin, lift up the protruding rim slightly and slide the uncut brownie out on its base. If you’re using a normal tin, lift out the brownie with the foil. Cut into quarters, then cut each quarter into four squares and finally into triangles.They’ll keep in an airtight container for a good two weeks and in the freezer for up to a month.",dessert,American,60,1,A foolproof brownie recipe for a squidgy chocolate bake. Watch our recipe video to help you get a perfect traybake every time.,Medium,www.bbcgoodfood.com/sites/default/files/styles/recipe/public/recipe_images/recipe-image-legacy-id--1001464_11.jpg?itok=Va_PfXJj
f17672605ba58e226ff9,4,823,Brilliant banana loaf,"Heat oven to 180C/160C fan/gas 4.Butter a 2lb loaf tin and line the base and sides with baking parchment.Cream 140g softened butter and 140g caster sugar until light and fluffy, then slowly add 2 beaten large eggs with a little of the 140g flour. Fold in the remaining flour, 1 tsp baking powder and 2 mashed bananas.Pour into the tin and bake for about 30 mins until a skewer comes out clean.Cool in the tin for 10 mins, then remove to a wire rack.Mix 50g icing sugar with 2-3 tsp water to make a runny icing. Drizzle the icing across the top of the cake and decorate with a handful of banana chips.",dessert,American,55,8,"A cross between banana bread and a drizzle cake, this easy banana loaf recipe is a quick bake that can be frozen and is great for using up overripe bananas",Easy,www.bbcgoodfood.com/sites/default/files/styles/recipe/public/recipe_images/recipe-image-legacy-id--1273522_8.jpg?itok=P8cLT0gJ
12f84704141e5efcd98d,5,527,Raspberry bakewell cake,"Heat oven to 180C/160C fan/gas 4 and base-line and grease a deep 20cm loose-bottomed cake tin. Blitz the ground almonds, butter, sugar, flour, eggs and vanilla extract in a food processor until well combined.Spread half the mix over the cake tin and smooth over the top. Scatter the raspberries over, then dollop the remaining cake mixture on top and roughly spread – you might find this easier to do with your fingers. Scatter with flaked almonds and bake for 50 mins until golden. Cool, remove from the tin and dust with icing sugar to serve.",dessert,American,60,8,This simple almondy cake is a great way of using up pick-your-own raspberries,Easy,www.bbcgoodfood.com/sites/default/files/styles/recipe/public/recipe_images/recipe-image-legacy-id--559459_11.jpg?itok=Dg7CFR8B
cacfe28b4d2c6964be85,5,15,"Somerset Pomona, apple & almond cake","Heat oven to 180C/fan 160C/gas 4. Butter and line the base and sides of a 20cm round cake tin. Peel, core and slice the apples to about the thickness of a £1 coin. Melt the knob of butter in a large frying pan then tip in the apples. Cook over a medium heat, stirring every so often till softened, but not soggy, about 5 mins. Splash in the Pomona and leave to cool. Tip onto a plate to cool more quickly if you like.Using an electric whisk or wooden spoon, beat the softened butter and sugar until creamy and light. Add the eggs a little at a time, beating after each addition, then fold in the flour and almonds. Finally, fold in half of the cooled apples. Spoon the mix into the prepared tin, smooth the top and scatter with the rest of the apples, pressing down lightly into the batter.Bake for 1 hr, until golden and a skewer inserted into the middle of the cake comes out clean. Check the cake after 45 mins, cover with foil if it’s browning too quickly. To make the glaze, warm the jam and Pomona in a small pan until the jam melts.Once the cake is out of the oven, prick it all over with a skewer and drizzle over a little more Pomona. Cool for 10 mins, then turn out of the tin and transfer to a wire rack. Brush the glaze over the apples and serve sliced, with dollops of Pomona cream. Best eaten on the day it’s made, or warmed through the next.",dessert,English,85,8,This simple cake makes a great dinner treat or serve with cream for a filling dessert,Medium,www.bbcgoodfood.com/sites/default/files/styles/recipe/public/recipe_images/recipe-image-legacy-id--4146_12.jpg?itok=zzMyT0W_
286a7c7866ffa2650643,5,7,"Cherry, almond & lemon mascarpone tart","Roll out the pastry on a lightly floured surface to just thinner than a £1 coin. Use to line a 22cm loose-bottomed tart tin, leaving an overhang on the sides. Leave to chill in the fridge on a baking sheet. To make the frangipane, whizz everything together in a food processor until combined.Heat oven to 200C/180C fan/gas 6 and line the tart case with baking parchment and beans. Bake for 20 mins, then remove parchment and beans, lightly prick the base with a fork and continue to bake for 10 mins until pale biscuity. Spread the frangipane over the base and return to the oven for 15 mins until cooked. Remove from the oven, trim the sides of the pastry and leave to cool completely.Beat the mascarpone with the lemon zest and juice and the icing sugar. Spread over the frangipane. Arrange the cherries on top, dust heavily with icing sugar, remove from the tin and serve.",dessert,Italian,75,8,"Round off an idyllic afternoon with friends by presenting this stunning, make-ahead dessert",Easy,www.bbcgoodfood.com/sites/default/files/styles/recipe/public/recipe_images/recipe-image-legacy-id--698516_11.jpg?itok=MPu-GdBW
397e7921ba58f77a9ce1,4,2,Apple & walnut marmalade,"Quarter and core the apples (no need to peel) and cut each quarter in half again. In a large frying pan, melt the butter, then add the apples, sugar, lemon zest and juice and the squeezed-out lemon halves and bay leaf. Carefully stir everything to combine, then cover and cook gently for about 10 mins or until the apples are just soft.Remove the lid and turn the heat to high. Allow the mixture to cook, uncovered, for a further 5 mins, or until most of the excess liquid has evaporated. It should be juicy and syrupy. Remove the lemon halves and bay, stir in the brandy, if using, and leave to cool slightly. Stir in the walnuts and serve warm.",dessert,English,30,3,"Easy and versatile, this preserve is great with scones",Easy,www.bbcgoodfood.com/sites/default/files/styles/recipe/public/recipe_images/recipe-image-legacy-id--3875_10.jpg?itok=SGpDJKCq
cb369a7d5b20b4bfb427,5,447,Chocolate brownie cake,"Heat oven to 180C/fan 160C/gas 4. Grease and line a 20cm cake tin.Place the butter, caster sugar, brown sugar, chocolate and golden syrup in the pan and melt gently on a low heat until it is smooth and lump-free.Remove the pan from the heat.Break the eggs into the bowl and whisk with the fork until light and frothy. 5 Add the eggs, vanilla extract or essence, flour, baking powder and cocoa powder to the chocolate mixture and mix thoroughly.Put the mixture into the greased and lined cake tin and place on the middle shelf of the oven. Bake for 25-30 mins.Remove and allow to cool for 20-30 mins before cutting into wedges and serving.Serve with cream or ice cream and plenty of fresh fruit.",dessert,American,45,6,"Get kids cooking at the weekend by baking this yummy brownie cake, much better than shop bought",Easy,www.bbcgoodfood.com/sites/default/files/styles/recipe/public/user-collections/my-colelction-image/2015/12/recipe-image-legacy-id--809539_11.jpg?itok=EyayrfJs
5abd684ef293eb899341,5,468,Easy chocolate fudge cake,"Heat oven to 180C/160C fan/gas 4. Grease and line the base of two 18cm sandwich tins.Sieve 175g self-raising flour, 2 tbsp cocoa powder and 1 tsp bicarbonate of soda into a bowl. Add 150g caster sugar and mix well.Make a well in the centre and add 2 tbsp golden syrup, 2 lightly beaten large eggs, 150ml sunflower oil and 150ml semi-skimmed milk. Beat well with an electric whisk until smooth.Pour the mixture into the two tins and bake for 25-30 mins until risen and firm to the touch. Remove from oven, leave to cool for 10 mins before turning out onto a cooling rack.To make your butter icing, place 100g unsalted butter in a bowl and beat until soft.Gradually sieve and beat in 225g icing sugar and 40g cocoa powder then add enough milk to make the icing fluffy and spreadable – around 2 ½ tbsp.Sandwich the two cakes together with the butter icing and cover the sides and the top of the cake with more butter icing.",dessert,American,55,8,Need a guaranteed crowd-pleasing cake that's easy to make? This super squidgy chocolate fudge cake with smooth icing is an instant baking win...,Easy,www.bbcgoodfood.com/sites/default/files/styles/recipe/public/recipe/recipe-image/2019/05/chocolate-fudge-cake.jpg?itok=otloAN04
ef43008554b87ff9d590,5,408,New York cheesecake,"Position an oven shelf in the middle of the oven. Heat the oven to 180C/ 160C fan/ gas 4.Line the base of a 23cm springform cake tin by putting a square piece of parchment paper or foil on top of the tin base and then clipping the side on so the paper or foil is trapped and any excess sticks out of the bottom.For the crust, melt 85g butter in a medium pan. Stir in 140g digestive biscuit crumbs and 1 tbsp golden caster or granulated sugar so the mixture is evenly moistened. Press the mixture into the bottom of the pan and bake for 10 minutes. Cool on a wire rack while preparing the filling.For the filling, increase the oven temperature to fan 220C/ 200C fan/ gas 7. In a table top mixer fitted with the paddle attachment, beat 900g full-fat soft cheese at medium-low speed until creamy, about 2 minutes.With the mixer on low, gradually add 250g golden caster sugar, then 3 tbsp plain flour and a pinch of salt, scraping down the sides of the bowl and the paddle twice.Swap the paddle attachment for the whisk. Continue by adding 1½ tsp vanilla extract, 2 tsp lemon zest and 1½ tsp lemon juice. Whisk in 3 large eggs and 1 yolk, one at a time, scraping the bowl and whisk at least twice.Stir a 284ml carton of soured cream until smooth, then measure 200ml (just over ¾ of the carton). Continue on low speed as you add the measured soured cream (reserve the rest). Whisk to blend, but don't over-beat. The batter should be smooth, light and somewhat airy.Brush the sides of the springform tin with melted butter and put on a baking sheet. Pour in the filling - if there are any lumps, sink them using a knife - the top should be as smooth as possible. Bake for 10 minutes.Reduce oven temperature to 110C/ 90C fan/ gas ¼ and bake for 45 minutes more. If you gently shake the tin, the filling should have a slight wobble.Turn off the oven and open the oven door for a cheesecake that's creamy in the centre, or leave it closed if you prefer a drier texture. Let cool in the oven for 2 hours. The cheesecake may get a slight crack on top as it cools.Combine the reserved soured cream with a 142ml carton soured cream, 1 tbsp golden caster sugar and 2 tsp lemon juice for the topping. Spread over the cheesecake right to the edges. Cover loosely with foil and refrigerate for at least 8 hours or overnight.Run a round-bladed knife around the sides of the tin to loosen any stuck edges. Unlock the side, slide the cheesecake off the bottom of the tin onto a plate, then slide the parchment paper out from underneath.",dessert,American,90,1,This authentic creamy dessert will add a taste of New York to any dining table,Easy,www.bbcgoodfood.com/sites/default/files/styles/recipe/public/user-collections/my-colelction-image/2015/12/recipe-image-legacy-id--1001487_11.jpg?itok=rUW9cFzU
fbd0c5b8660e5b1815d9,5,1,Medley of summer fruits,"In a large saucepan, bring the two wines, sugar and vanilla pod to the boil. Put the mint and basil in the centre of a small piece of muslin and tie with string to make a bag, then add to the pan with a few turns of freshly ground black pepper.Remove from heat and leave to come to room temperature. Remove muslin bag, add raspberries and the melon balls. Chill for at least 4 hrs.About 2 hrs before you intend to serve the fruits, add the strawberries and wild strawberries, if using, to the syrup. Serve in a large serving bowl or four individual bowls. Pour about 2 tbsp of the pink Champagne over just before serving.",dessert,Italian,50,4,Raymond Blanc's fantastically fruity pudding can be made up to 6 hours in advance,Easy,www.bbcgoodfood.com/sites/default/files/styles/recipe/public/recipe_images/recipe-image-legacy-id--2203_11.jpg?itok=qYaYfkOE
